{
  "scan_id": "scan-synthetic-001",
  "tenant_id": "tenant-example",
  "schema_version": "1.0.0",
  "document_type": "driver_license",
  "country": "DO",
  "engine": {
    "name": "synthetic-ocr",
    "version": "0.0.0"
  },
  "fields": {
    "full_name": null,
    "document_number": null,
    "address": null,
    "height": null,
    "weight_lb": null,
    "sex": null,
    "blood_type": null,
    "birth_date": null,
    "issue_date": null,
    "expiry_date": null,
    "category": null,
    "restriction": null,
    "first_issue_date": null,
    "card_serial": null
  },
  "field_evidence": {
    "document_number": [
      {
        "source": "ocr",
        "confidence": 0.98,
        "page": 1,
        "bbox": [
          0.1,
          0.1,
          0.4,
          0.2
        ],
        "raw_text": "000-0000000-0"
      }
    ]
  },
  "warnings": [],
  "qr_evidence": {
    "status": "decoded",
    "payload_digest": "sha256:aaaaaaaaaaaaaaaaaaaaaaaaaaaaaaaaaaaaaaaaaaaaaaaaaaaaaaaaaaaaaaaa",
    "raw_payload": "SYNTHETIC-QR"
  },
  "content_digests": [
    {
      "role": "front",
      "digest": "sha256:aaaaaaaaaaaaaaaaaaaaaaaaaaaaaaaaaaaaaaaaaaaaaaaaaaaaaaaaaaaaaaaa"
    }
  ]
}
